{
  "status": "healthy",
  "timestamp": "2026-02-08T04:00:00Z",
  "service": "openclaw-runtime",
  "checks": [
    {
      "name": "runtime_ping",
      "probe_type": "liveness",
      "status": "healthy",
      "message": "runtime alive",
      "duration_ms": 4.2,
      "timestamp": "2026-02-08T04:00:00Z"
    }
  ],
  "summary": {
    "total": 1,
    "healthy": 1,
    "degraded": 0,
    "unhealthy": 0,
    "unknown": 0
  }
}
