{
  "status": "degraded",
  "timestamp": "2026-02-08T04:01:00Z",
  "service": "openclaw-runtime",
  "version": "0.1.0",
  "latency_ms": 112.4,
  "checks": [
    {
      "name": "runtime_ping",
      "probe_type": "liveness",
      "status": "healthy",
      "message": "runtime alive",
      "duration_ms": 3.4,
      "timestamp": "2026-02-08T04:01:00Z"
    },
    {
      "name": "provider_latency",
      "probe_type": "readiness",
      "status": "degraded",
      "message": "provider responding slowly",
      "duration_ms": 108.2,
      "timestamp": "2026-02-08T04:01:00Z",
      "details": {
        "provider": "openai",
        "p95_ms": 1520
      }
    }
  ],
  "summary": {
    "total": 2,
    "healthy": 1,
    "degraded": 1,
    "unhealthy": 0,
    "unknown": 0
  }
}
